{
  "evidence_id": "E2",
  "doc_id": "insp-2024-22",
  "doc_type": "inspection_report",
  "asset_type": "table_image",
  "asset_id": "asset-22-011",
  "asset_s3_key": "documents-assets/insp-2024-22/asset-22-011.png",
  "page": 9,
  "caption": "Table summarizing corrosion trigger thresholds by exposure type.",
  "presigned_url": "https://example.com/presigned/documents-assets/insp-2024-22/asset-22-011.png?sig=abc123"
}

